<!ELEMENT library (books)>


<!ELEMENT books (book+)>
<!ELEMENT book (id, title, author, year, isbn)>

<!ELEMENT id (#PCDATA)>
<!ELEMENT title (#PCDATA)>
<!ELEMENT author (#PCDATA)>
<!ELEMENT year (#PCDATA)>
<!ELEMENT isbn (#PCDATA)>
