<?xml version="1.0" encoding="UTF-8"?>
<!DOCTYPE library SYSTEM "validate.dtd">
<library>
    <books>
        <book>
            <id>1</id>
            <title>The Great Gatsby</title>
            <author>F.Scott Fitzgerald</author>
            <year>1925</year>
            <isbn>978-0-7432-7432-7356-5</isbn>
        </book>
        <book>
            <id>2</id>
            <title>To Kill a Mockingbird</title>
            <author>Harper Lee</author>
            <year>1960</year>
            <isbn>978-0-06-112008-4</isbn>
        </book>
        <book>
            <id>3</id>
            <title>1984</title>
            <author>George Orwell</author>
            <year>1949</year>
            <isbn>978-0-452-28423-4</isbn>
        </book>
        <book>
            <id>4</id>
            <title>Pride and Prejudice</title>
            <author>Jane Austen</author>
            <year>1813</year>
            <isbn>978-0-14-143951-8</isbn>
        </book>
    </books>
</library>
